[
    {
        "timestamp": "2025-07-19 16:14:20",
        "weather": "Sunny",
        "season": "Spring",
        "mood": "Confident",
        "event": "Office Meeting",
        "style_preference": "Casual",
        "color_preference": "Neutral",
        "outfit": "- **Outfit**:\n\n\ud83d\udc56 Blue jeans\n\ud83d\udc55 White cotton shirt\n\ud83e\udde5 Black leather jacket (worn open)\n\ud83d\udc5f White sneakers\n\u231a\ufe0f Simple silver watch\n\n\n- **Visual Preview**:\n\n```\n      \u2600\ufe0f\n     /   \\\n    |     |\n    \ud83d\udc56     \ud83d\udc55  (White shirt tucked into jeans)\n    \\  \ud83e\udde5 / (Black leather jacket draped open over shoulders)\n     \\ /\n      \ud83d\udc5f\ud83d\udc5f (White sneakers)\n      \u231a\ufe0f (Simple silver watch on wrist) \n```\n\n\n- **Explanation**:\n\nThis outfit perfectly embodies a confident, casual spring look suitable for an office meeting.  The sunny weather calls for lightweight fabrics and breathable footwear; the white cotton shirt and blue jeans provide this.  The black leather jacket adds a touch of effortless cool and sophistication, without being overly formal.  The open jacket creates a relaxed, yet put-together feel. The white sneakers maintain the casual vibe, suitable for a spring day and comfortable enough for a full day in the office.  The neutral color palette (blue, white, black) aligns with the user's preference, creating a clean and chic look.  The entire look exudes confidence without sacrificing comfort. The red hoodie is omitted as it clashes with the desired neutral color palette and would be too informal for a meeting.  The black heels are similarly unsuitable for a casual office meeting look.\n\n\n- **Styling Tips**:\n\n* **Tuck and Cuff:** Tuck the white shirt neatly into the jeans, and subtly cuff the sleeves above the wrist for a polished yet relaxed touch.\n* **Accessorize Sparingly:** A simple silver watch adds a touch of understated elegance without overwhelming the neutral color scheme. Avoid overly flashy jewelry.\n* **Hair and Makeup:** Keep the hair neatly styled (a simple ponytail or loose waves work well), and opt for natural-looking makeup that enhances your features without being distracting.\n* **Jacket Placement:** The open black jacket should drape comfortably over the shoulders, adding a subtle yet stylish layer. If needed, you can tie a knot around your waist, creating another interesting silhouette.\n* **Confidence is Key:** Wear the outfit with confidence \u2013 your attitude is the best accessory!\n\n\n"
    }
]